{
  "schema_version": "1.0.0",
  "generated_at": "2026-08-05T15:23:54.702166+00:00",
  "public_data_root": "/data",
  "assets": {
    "capex-execution": {
      "data_path": "/data/capex-analysis/capex-execution.json",
      "schema_path": "/data/schemas/dated_multi_series.schema.json",
      "schema": "dated_multi_series",
      "expected_frequency": "annual",
      "stale_after_days": 450,
      "cache_strategy": "revalidate",
      "version": "2026-08-05",
      "availability": "active",
      "description": "Has actual public CapEx intensified and been executed?"
    },
    "capex-sector-allocation": {
      "data_path": "/data/capex-analysis/sector-capex-allocation.json",
      "schema_path": "/data/schemas/dated_multi_series.schema.json",
      "schema": "dated_multi_series",
      "expected_frequency": "annual",
      "stale_after_days": 450,
      "cache_strategy": "revalidate",
      "version": "2026-08-05",
      "availability": "active",
      "description": "How much central-budget CapEx was allocated to roads and railways?"
    },
    "capex-physical-delivery": {
      "data_path": "/data/capex-analysis/physical-delivery.json",
      "schema_path": "/data/schemas/dated_multi_series.schema.json",
      "schema": "dated_multi_series",
      "expected_frequency": "annual",
      "stale_after_days": 450,
      "cache_strategy": "revalidate",
      "version": "2026-08-05",
      "availability": "active",
      "description": "Did roads and railways deliver physical output?"
    },
    "capex-capital-goods-production": {
      "data_path": "/data/capex-analysis/capital-goods-production.json",
      "schema_path": "/data/schemas/dated_multi_series.schema.json",
      "schema": "dated_multi_series",
      "expected_frequency": "annual",
      "stale_after_days": 450,
      "cache_strategy": "revalidate",
      "version": "2026-08-05",
      "availability": "active",
      "description": "Did capital-goods production rise alongside the CapEx push?"
    },
    "capex-sector-performance": {
      "data_path": "/data/capex-analysis/sector-performance.json",
      "schema_path": "/data/schemas/market_performance.schema.json",
      "schema": "market_performance",
      "expected_frequency": "monthly",
      "stale_after_days": 45,
      "cache_strategy": "revalidate",
      "version": "2026-08-05",
      "availability": "active",
      "description": "Did CapEx-sensitive sectors outperform the Nifty 50?"
    },
    "capex-sector-correlations": {
      "data_path": "/data/capex-analysis/capex-sector-correlations.json",
      "schema_path": "/data/schemas/dated_multi_series.schema.json",
      "schema": "dated_multi_series",
      "expected_frequency": "annual",
      "stale_after_days": 450,
      "cache_strategy": "revalidate",
      "version": "2026-08-05",
      "availability": "active",
      "description": "Was CapEx growth followed by sector excess returns?"
    },
    "capex-private-response": {
      "data_path": "/data/capex-analysis/private-investment-response.json",
      "schema_path": "/data/schemas/dated_multi_series.schema.json",
      "schema": "dated_multi_series",
      "expected_frequency": "mixed",
      "stale_after_days": 120,
      "cache_strategy": "revalidate",
      "version": "2026-08-05",
      "availability": "active",
      "description": "Did private investment and manufacturing capacity respond?"
    },
    "capex-fiscal-sustainability": {
      "data_path": "/data/capex-analysis/fiscal-sustainability.json",
      "schema_path": "/data/schemas/dated_multi_series.schema.json",
      "schema": "dated_multi_series",
      "expected_frequency": "annual",
      "stale_after_days": 450,
      "cache_strategy": "revalidate",
      "version": "2026-08-05",
      "availability": "active",
      "description": "Can the CapEx push continue without excessive debt-service pressure?"
    },
    "capex-corporate-fundamentals": {
      "data_path": "/data/capex-analysis/corporate-fundamentals.json",
      "schema_path": "/data/schemas/dated_multi_series.schema.json",
      "schema": "dated_multi_series",
      "expected_frequency": "annual",
      "stale_after_days": 450,
      "cache_strategy": "revalidate",
      "version": "2026-08-05",
      "availability": "active",
      "description": "Did market expectations coincide with stronger corporate revenue, investment and productive assets?"
    },
    "capex-investment-quality": {
      "data_path": "/data/capex-analysis/investment-quality.json",
      "schema_path": "/data/schemas/dated_multi_series.schema.json",
      "schema": "dated_multi_series",
      "expected_frequency": "annual",
      "stale_after_days": 450,
      "cache_strategy": "revalidate",
      "version": "2026-08-05",
      "availability": "active",
      "description": "Did monitored central-sector projects improve on delivery timing and cost control?"
    },
    "capex-state-evaluation": {
      "data_path": "/data/capex-analysis/state-capex-evaluation.json",
      "schema_path": "/data/schemas/dated_multi_series.schema.json",
      "schema": "dated_multi_series",
      "expected_frequency": "annual",
      "stale_after_days": 450,
      "cache_strategy": "revalidate",
      "version": "2026-08-05",
      "availability": "active",
      "description": "Do within-state changes in capital outlay precede stronger real GSDP growth?"
    },
    "capex-crowding-in-evidence": {
      "data_path": "/data/capex-analysis/crowding-in-evidence.json",
      "schema_path": "/data/schemas/dated_multi_series.schema.json",
      "schema": "dated_multi_series",
      "expected_frequency": "annual",
      "stale_after_days": 450,
      "cache_strategy": "revalidate",
      "version": "2026-08-05",
      "availability": "active",
      "description": "Do private-investment and production outcomes respond at registered CapEx leads?"
    }
  },
  "sections": [
    {
      "id": "capex-transmission",
      "label": "India's public CapEx transmission",
      "order": 1,
      "indicators": [
        {
          "id": "capex-policy-input",
          "title": "1. Public CapEx intensity and execution",
          "summary": "Has central-government capital expenditure increased relative to GDP and total spending, and were original budgets delivered?",
          "default_view": "vintages",
          "views": [
            {
              "id": "vintages",
              "label": "BE, RE and actual",
              "asset_id": "capex-execution",
              "presentation": {
                "component": "multi-series-line",
                "chart_type": "line",
                "x_axis": "date",
                "default_visible": [
                  "capex_budget_estimate",
                  "capex_revised_estimate",
                  "capex_actual"
                ],
                "value_format": {
                  "style": "number",
                  "scale": 1,
                  "decimals": 0,
                  "prefix": "₹",
                  "suffix": " cr"
                },
                "controls": {
                  "date_range": true,
                  "entity_toggle": false,
                  "series_toggle": false
                },
                "zero_line": false,
                "show_source": true,
                "show_methodology": true
              },
              "note": "Descriptive evidence; common movements do not identify a causal effect of public CapEx."
            },
            {
              "id": "execution",
              "label": "Execution",
              "asset_id": "capex-execution",
              "presentation": {
                "component": "multi-series-line",
                "chart_type": "line",
                "x_axis": "date",
                "default_visible": [
                  "capex_execution_ratio"
                ],
                "value_format": {
                  "style": "percent",
                  "scale": 1,
                  "decimals": 1
                },
                "controls": {
                  "date_range": true,
                  "entity_toggle": false,
                  "series_toggle": false
                },
                "zero_line": false,
                "show_source": true,
                "show_methodology": true
              },
              "note": "Descriptive evidence; common movements do not identify a causal effect of public CapEx."
            }
          ]
        },
        {
          "id": "capex-sector-delivery",
          "title": "1B. Sector allocation and physical delivery",
          "summary": "Separating budget inputs from completed kilometres shows whether the CapEx push moved beyond headline allocations.",
          "default_view": "allocation",
          "views": [
            {
              "id": "allocation",
              "label": "Central budget allocation",
              "asset_id": "capex-sector-allocation",
              "presentation": {
                "component": "multi-series-line",
                "chart_type": "line",
                "x_axis": "date",
                "default_visible": [
                  "railways_budget_capex",
                  "roads_budget_capex"
                ],
                "value_format": {
                  "style": "number",
                  "scale": 1,
                  "decimals": 0,
                  "prefix": "₹",
                  "suffix": " cr"
                },
                "controls": {
                  "date_range": true,
                  "entity_toggle": false,
                  "series_toggle": true
                },
                "zero_line": false,
                "show_source": true,
                "show_methodology": true
              },
              "note": "Descriptive evidence; common movements do not identify a causal effect of public CapEx."
            },
            {
              "id": "delivery",
              "label": "Physical delivery",
              "asset_id": "capex-physical-delivery",